id,alias,name,image_url,is_claimed,is_closed,url,phone,display_phone,review_count,categories,rating,location,coordinates,photos,price,hours,transactions,messaging,special_hours,reviews
YXm8iV74_okgbFJG04e2KA,mister-falafel-san-diego,Mister Falafel,https://s3-media3.fl.yelpcdn.com/bphoto/5hic3XCjegM_WlG4Oi1Baw/o.jpg,True,False,https://www.yelp.com/biz/mister-falafel-san-diego?adjust_creative=PSmU_iV5giP-Cb4BnfhqTw&utm_campaign=yelp_api_v3&utm_medium=api_v3_business_lookup&utm_source=PSmU_iV5giP-Cb4BnfhqTw,+18584900170,(858) 490-0170,943,"[{'alias': 'lebanese', 'title': 'Lebanese'}, {'alias': 'mediterranean', 'title': 'Mediterranean'}, {'alias': 'desserts', 'title': 'Desserts'}]",4.5,"{'address1': '4461 Clairemont Mesa Blvd', 'address2': None, 'address3': '', 'city': 'San Diego', 'zip_code': '92117', 'country': 'US', 'state': 'CA', 'display_address': ['4461 Clairemont Mesa Blvd', 'San Diego, CA 92117'], 'cross_streets': 'Dubois Dr & Genesee Ave'}","{'latitude': 32.8340114733396, 'longitude': -117.195659638192}","['https://s3-media3.fl.yelpcdn.com/bphoto/5hic3XCjegM_WlG4Oi1Baw/o.jpg', 'https://s3-media2.fl.yelpcdn.com/bphoto/90qSjlyfsEqVRLikzL9o0g/o.jpg', 'https://s3-media1.fl.yelpcdn.com/bphoto/MuOvCIMS1UI_eZp2kqlGGw/o.jpg']",$,"[{'open': [{'is_overnight': False, 'start': '1200', 'end': '1900', 'day': 1}, {'is_overnight': False, 'start': '1200', 'end': '1900', 'day': 2}, {'is_overnight': False, 'start': '1200', 'end': '1900', 'day': 3}, {'is_overnight': False, 'start': '1200', 'end': '1900', 'day': 4}, {'is_overnight': False, 'start': '1200', 'end': '1900', 'day': 5}, {'is_overnight': False, 'start': '1200', 'end': '1900', 'day': 6}], 'hours_type': 'REGULAR', 'is_open_now': False}]","['pickup', 'delivery']","{'url': 'https://www.yelp.com/raq/YXm8iV74_okgbFJG04e2KA?adjust_creative=PSmU_iV5giP-Cb4BnfhqTw&utm_campaign=yelp_api_v3&utm_medium=api_v3_business_lookup&utm_source=PSmU_iV5giP-Cb4BnfhqTw#popup%3Araq', 'use_case_text': 'Message the Business'}",,"[""i got (dine in/takeout):baba ganoush (5/5): delicious, lots of herbs & spices, went great on pitaregular salad (4/5): plain, nothing specialbeef shawarma fries (5/5): excellent hangover food service (5/5): incredibly friendly staffparking: 10+ spots in the backnext time i'd order:falafel sandwich or falafel plates seem like a better deal"", ""Simply satisfying!I was in the area and wanted to try a new local place. This place has raving stars so I went ahead to try it. I got the chicken shawarma and it was simply satisfying!The chicken itself was juicy, the portion was perfect, the owner/staff is the sweetest gentleman, overall a pretty good experience for me.My suggestion, if you enjoy the garlic sauce, just ask for extra on the side. Only reason I didn't give it a 5 star is because as satisfying as it was for me, it's not something I can see myself crave to go back for again. I still have my own fave shawarma spots. But... If you're in the area, definitely worth trying out!"", ""OK here's the deal:Order the Chicken Schwarma plate. Get the cucumber yogurt and baba ganoush. It comes with a garlic spread on the side. Then you order ANOTHER side of garlic spread... a big one. I actually add the garlic spread to my home cooking! Melt a spoonful into pasta for delicious garlicky aroma, slather it onto baguette to make easy garlic bread, or add it to sautÃ©ed veggies! It's absolutely DIVINE. The owner is SO friendly and my day is always made better after seeing him & getting to eat their food. You won't regret coming here!"", 'Hole in the wall restaurant/Mom and pop feeling. Good food I was worth the drive. \xa0Flavorful ingredients, with crunchy bread! \xa0The homemade hummus with garlic after taste was incredible. \xa0Will come back again.', ""Highly recommended! If you like Mediterranean food, you can't miss this restaurant. The food taste delicious and freshly cooked for every order. I recommend coming for lunch because it less busy and you don't need to wait long. The Shawarma plate comes with 2 sides and pita bread and it's only $13.5. I consider this very cheap. They do both dine in and take out. There are not many tables but it's great to sit both outdoor and indoor. The owners are very friendly and super polite. If you need any adjustments on the food or extra of anything just ask. My favorite is beef shawarma. The baklava is also great and a lot less super sweet than many places."", 'This is a hole in the wall spot that we decided to try on a whim.The owner/operator is incredible. Very friendly, informative, and definitely wants to you have a good experience. We told him it was our first time here and we weren\'t really sure what to try, and he gave us a good run down of the menu, and promised us if there was anything we didn\'t like, he would make us something else and that ""we wouldn\'t leave hungry"".This is exactly the type of hospitality that builds a loyal and satisfied customer base.The service was great and the food was very good as well! We split a plate, and it was decently priced for the amount of food you get.The hummus was very good, a bit thinner than some I\'ve had, but that\'s not at all a negative. The chicken was very good. It was hot and not dry at all... I didn\'t know what to expect since people\'s images show a chunky/shredded type chicken, whereas we are used to shaved in shawarma. But it definitely satisfied.Like I said the place is tiny, with very limited seating outside, but while our meal was cooking he even came and wiped down our table.Good food, excellent service by a likeable owner, and not too hard on the wallet!We will return and you should check them out too!', 'New favorite spot! The food is so fresh and delicious! We got the Falafel Plate and Chicken Shawarma Fries, both were so good. The fries were all over in the Yelp pictures so we decided to try them and would definitely recommend! The owners were also super friendly! Cant wait to go back!', ""We ate here for lunch shorty after getting out of church on Sunday. We ordered their Chicken Falafel Plate with hummus, french fries, rice pilaf, yogurt, and pita bread. My wife and I shared this dish as a lunch meal. We also had their house green salad and a pistachio flavored finger cookie dessert. Mister Falafel is a Lebanese/Mediterranean restaurant which has been around for quite a long time. For takeout or delivery, you definitely can't go wrong. If desiring to dine in, depending on the time of day/night, you could be caught with limited seating. There's seating for no more than 10 patrons indoors, and maybe 4-6 immediately outside. There are no public restrooms for customers. But the food is delicious, the service and hospitality could not be better. We were so hungry, by the time our food arrived, I had forgotten to take photos to accompany this Yelp review."", ""Absolutely lovely! We ordered food from Mister Falafel this last week and it was fantastic! My only disappointment is that I haven't discovered it sooner! The food was fresh, flavorful, and delicious! The serving sizes were perfect and I would recommend to anyone and everyone! We will definitely be back and lifelong patrons!"", ""This place is awesome. My girl found it on Yelp and we wanted to get fresh food, holy sweets did we get it. I ordered the chicken shawarma wrap and she got the falafel munchies and a house salad. Some of the best food we've had hands down. And the love. You can hear, see, taste, the love from the owners and they give it in every way. The chicken was seasoned in a way I've not tasted and was so juicy and delicious. The falafel was crusted perfectly and came with pita, veggies, and a spread that was unique and tasty. The house salad had a dressing that added a nice zest and tang to the nice mix of vegetables in the bowl. I'm really glad we found this place a few days ago and headed back soon. Next time I'll update with photos.""]"
AkYIj8yYAURrCLKWnZJMJA,the-fancy-fish-san-diego-2,The Fancy Fish,https://s3-media2.fl.yelpcdn.com/bphoto/PSntMkLeVE-A_q1pvcrsTA/o.jpg,True,False,https://www.yelp.com/biz/the-fancy-fish-san-diego-2?adjust_creative=PSmU_iV5giP-Cb4BnfhqTw&utm_campaign=yelp_api_v3&utm_medium=api_v3_business_lookup&utm_source=PSmU_iV5giP-Cb4BnfhqTw,+18585866228,(858) 586-6228,496,"[{'alias': 'seafood', 'title': 'Seafood'}, {'alias': 'fishnchips', 'title': 'Fish & Chips'}]",4.5,"{'address1': '9430 Mira Mesa Blvd', 'address2': 'Ste 5B', 'address3': '', 'city': 'San Diego', 'zip_code': '92126', 'country': 'US', 'state': 'CA', 'display_address': ['9430 Mira Mesa Blvd', 'Ste 5B', 'San Diego, CA 92126'], 'cross_streets': 'Black Mountain Rd & Westview Pky'}","{'latitude': 32.918365, 'longitude': -117.122496}","['https://s3-media2.fl.yelpcdn.com/bphoto/PSntMkLeVE-A_q1pvcrsTA/o.jpg', 'https://s3-media1.fl.yelpcdn.com/bphoto/UK9tEQs8tyAum9kuvUrPzQ/o.jpg', 'https://s3-media1.fl.yelpcdn.com/bphoto/QfhUZ81FVR6OLD6EkAuXYQ/o.jpg']",$$,"[{'open': [{'is_overnight': False, 'start': '1100', 'end': '2100', 'day': 1}, {'is_overnight': False, 'start': '1100', 'end': '2100', 'day': 2}, {'is_overnight': False, 'start': '1100', 'end': '2100', 'day': 3}, {'is_overnight': False, 'start': '1100', 'end': '2200', 'day': 4}, {'is_overnight': False, 'start': '1100', 'end': '2200', 'day': 5}, {'is_overnight': False, 'start': '1100', 'end': '2000', 'day': 6}], 'hours_type': 'REGULAR', 'is_open_now': False}]",['delivery'],,,"[""Very clean and modern place with an open kitchen and easy to navigate menu and dining room.We ordered the Black Bean White Fish and the Steamed Cod with Garlic Butter and sides of rice, fries, coleslaw and zucchini.Ok...Wow! Great food. Fresh, flavored, simple. Definitely fresh fish with no bones and the right amount of food. The garlic butter sauce is awesome. We loved it so much we took the sauce leftover home!A very pleasant surprise is their Sour Chili Sauce on the table! Spicy, sour, sweet and tons of flavor. PS - The other bottle on the table is a great homemade ketchup.We'll definitely be back."", ""Pros: Nice staff to help maneuver the menu.Hong Kong steamed fish was great!Nice side options, I loved the grilled zucchini \xa0!Bf loved his clams, soft shell crab bao and salt & pepper chicken wingsThey thank you for dining when you leave. Cons:Eventhough the fried shrimp was clean, it is way too hard. I didn't even finish eating them.Foodserver asked if everything was ok? I said everything is great except the fries are cold. 'Ok' \xa0I left those on the plate also.Women's restroom was 'Out of Order' and the Men's was nasty.Overall, we will return. Just know 2 items not to order."", 'This is my fave fish n chips place in San Diego. Seriously. I have eaten at lots of restaurants that serve fish n chips on the menu... I\'m talking about restaurants that specifically special in fish n chips. I have lived here my whole life and I cannot rave about this place enough. The ironic thing, about this place, even though it\'s called ""Fancy Fish"" I wouldn\'t say their food is ""fancy"". All their food is straight to the point without extra add-ins or garnish. I actually love that. They pride themselves on serving fish with flavor! They provide truly good portions for the $$. In fact, I would say you could almost feed 2 smaller eaters with one plate of $7!!! Such a hidden gem, located next to one of the busiest Asian Grocery stores ever but if you get a chance, stop by.', 'Due to having a lot of dietary restrictions the way the menu is set up is perfect and there were way more options for things I could eat than I imagined. \xa0Their grilled white fish with the Cajun rub was amazing. \xa0The fish was cooked perfectly and you get such a generous serving of food. \xa0The staff is extremely friendly and courteous and maintains a clean environment.', ""Wow I haven't been here in exactly a year but the cashier Still remembers me and that I always get hot sauce With my order. That's good customer service.They're offering Apple Pay which is nice especially with covid going on.I ordered my usual tilapia with Cajun seasoning tempura style, with Cole slaw and French fries. It doesn't get any better than this tbh. All that for $10 like what a steal. I also gotta get tartar sauce and hot sauce on the side always. Hot sauce to pour on my fish and tartar sauce to dip my fries in. The fish when it's tempura style is hella crispy which I love And their fries are crispy too. Their Cole slaw just has the right amount of mayo on them which is awesome. They have hand sanitizer at the register (really big Costco sized containers of them) which is good. And I feel like they have good safety precautions in place by keeping the front door open to allow for ventilation and minimal contact with the door. Overall really good food still, quality is still the same and just as delicious, and good customer service."", ""This is a very nice place to go with some co-workers after work. Good food good beer friendly management. 10/ 10 highly recommend. Simon is the owner and he is very pleasant. He came to say hello and see how our food was . We have eaten here to go a couple times. Tonight was out first time dining in. Service with a smile and tentative to our needs. Let us order our chicken to go but waited to cook it until we were almost done eating so it was fresh when we left. \xa0I'm not a photographer so don't judge based on the photos lol. The food is delicious and fresh."", ""The Fancy Fish has evolved over the years since they first debuted right next door to H Mart in Mira Mesa. The business name originally made me think of different ways the kitchen could prepare, cook, and serve fish. Instead, the menu had a focus on a variety of Asian style tapas with the highlight being their baos. The soft shell crab bao was the variety I picked on my first visit. They put an entire deep-fried soft shell crab in between the dough to make it look intimidating. The taste was pretty good though.On a more recent stop here, it does appear that the cooks have expanded their repertoire. There were numerous styles of Asian prepared fish on the menu with a photo for each item. The fried seafood fare seemed to be highlighted more too with a giant Fish 'N Chips banner hanging in front of the suite. I ordered a variation of that by opting for the Shrimp, Fish 'N Chips platter. There were about half a dozen shrimp and a large whitefish fillet in this combo. Both were nicely fried, however the number of french fries included was rather skimpy. The creamy cole slaw was decent.The prices were good, and I noticed they had a dozen available sauces to choose from. The preparation time was on the slow side as it took about 20 minutes from when I ordered to when I received my food. I do appreciate that the kitchen was making everything fresh though. Overall, I gave a 3.5 star rating for my experiences at The Fancy Fish."", 'Dried mahi-mahi. \xa0Literally jerky! \xa0Soft shell crab over salted. \xa0Cmon guys, what a miss.', 'Friendly staff. Fish and shrimp taste good, fish could be a lot thicker it so thin compre to other places i ate fish and chips. Coleslaw bland needs more mayonaise. Price is good for the items on the plate. Would recommend to other people and friends', ""I was a little underwhelmed. The service was excellent. The food quality was fine. I was a bit disappointed in the size and quantity of shrimp. The fish, shrimp, and chips combo was a dollar more than the shrimp and chips combo. So maybe they don't give you much or bigger portions for a mere dollar extra. At least the fish was big. i was also hoping for beer batter fish. The batter was crispy but bland. I'm not a fan of cole slaw either. But it wasn't too goopy or runny - which is good. Overall decent, but not amazing, food.""]"
M34QPA68ziDRYaj2c97Rpg,greensplease-san-diego,GreensPlease,https://s3-media1.fl.yelpcdn.com/bphoto/Q8rIpoDAXXHlAr6RRsj8zQ/o.jpg,True,False,https://www.yelp.com/biz/greensplease-san-diego?adjust_creative=PSmU_iV5giP-Cb4BnfhqTw&utm_campaign=yelp_api_v3&utm_medium=api_v3_business_lookup&utm_source=PSmU_iV5giP-Cb4BnfhqTw,+18588421001,(858) 842-1001,299,"[{'alias': 'juicebars', 'title': 'Juice Bars & Smoothies'}, {'alias': 'vegan', 'title': 'Vegan'}, {'alias': 'gluten_free', 'title': 'Gluten-Free'}]",5.0,"{'address1': '12202 Poway Rd', 'address2': 'Ste 100', 'address3': '', 'city': 'San Diego', 'zip_code': '92064', 'country': 'US', 'state': 'CA', 'display_address': ['12202 Poway Rd', 'Ste 100', 'San Diego, CA 92064'], 'cross_streets': 'Oak Knoll Rd & Pomerado Rd'}","{'latitude': 32.9512697, 'longitude': -117.0675314}","['https://s3-media1.fl.yelpcdn.com/bphoto/Q8rIpoDAXXHlAr6RRsj8zQ/o.jpg', 'https://s3-media3.fl.yelpcdn.com/bphoto/Hj8fzbhKtWLHK9ZNF79vSA/o.jpg', 'https://s3-media2.fl.yelpcdn.com/bphoto/4VZCPziKi_UurFsvxcBAag/o.jpg']",$$,"[{'open': [{'is_overnight': False, 'start': '1000', 'end': '1500', 'day': 1}, {'is_overnight': False, 'start': '1000', 'end': '1500', 'day': 2}, {'is_overnight': False, 'start': '1000', 'end': '1500', 'day': 3}, {'is_overnight': False, 'start': '1000', 'end': '1500', 'day': 4}, {'is_overnight': False, 'start': '1000', 'end': '1500', 'day': 5}], 'hours_type': 'REGULAR', 'is_open_now': False}]",['delivery'],,"[{'date': '2021-11-25', 'is_closed': True, 'start': None, 'end': None, 'is_overnight': None}, {'date': '2021-11-26', 'is_closed': True, 'start': None, 'end': None, 'is_overnight': None}, {'date': '2021-11-26', 'is_closed': True, 'start': None, 'end': None, 'is_overnight': None}, {'date': '2021-11-27', 'is_closed': True, 'start': None, 'end': None, 'is_overnight': None}, {'date': '2021-12-25', 'is_closed': True, 'start': None, 'end': None, 'is_overnight': None}, {'date': '2021-12-26', 'is_closed': True, 'start': None, 'end': None, 'is_overnight': None}]",[]
dJq_Q0U3ERTbnssTqJFQew,a-street-food-and-desserts-poway,A Street Food And Desserts,https://s3-media2.fl.yelpcdn.com/bphoto/CgqEKf_Ko74NFvoSFg5I7g/o.jpg,True,True,https://www.yelp.com/biz/a-street-food-and-desserts-poway?adjust_creative=PSmU_iV5giP-Cb4BnfhqTw&utm_campaign=yelp_api_v3&utm_medium=api_v3_business_lookup&utm_source=PSmU_iV5giP-Cb4BnfhqTw,+16198320099,(619) 832-0099,132,"[{'alias': 'chicken_wings', 'title': 'Chicken Wings'}, {'alias': 'asianfusion', 'title': 'Asian Fusion'}, {'alias': 'seafood', 'title': 'Seafood'}]",4.5,"{'address1': '12855 Pomerado Rd', 'address2': 'Ste A', 'address3': None, 'city': 'Poway', 'zip_code': '92064', 'country': 'US', 'state': 'CA', 'display_address': ['12855 Pomerado Rd', 'Ste A', 'Poway, CA 92064'], 'cross_streets': 'Oak Knoll Rd'}","{'latitude': 32.949738, 'longitude': -117.062173}","['https://s3-media2.fl.yelpcdn.com/bphoto/CgqEKf_Ko74NFvoSFg5I7g/o.jpg', 'https://s3-media1.fl.yelpcdn.com/bphoto/4x94S5G4tZMBD7rNrXKGmw/o.jpg', 'https://s3-media1.fl.yelpcdn.com/bphoto/9uOdCUtsA3Jzh5Nr3IfnWA/o.jpg']",,"[{'open': [{'is_overnight': False, 'start': '2345', 'end': '0000', 'day': 3}, {'is_overnight': False, 'start': '1200', 'end': '2000', 'day': 4}, {'is_overnight': False, 'start': '1200', 'end': '2000', 'day': 5}, {'is_overnight': False, 'start': '1200', 'end': '2000', 'day': 6}], 'hours_type': 'REGULAR', 'is_open_now': False}]",['delivery'],,,"[""Food was delicious! \xa0We got a full order of OG wings (12 wings in the order), Singapore noodles, garlic noodles, and skewers. \xa0The wings were super crispy even though they were sitting in the box for at least 20 mins. Garlic noodles is def effective in warding off any vampires.The only problems was I didn't have th foresight to order a full size of the papaya salad. We def will be back!"", 'Unique and thoughtful menu with tasty food and generous portions!Ordered pickup by phone. Fast pickup with easy parking. OG Krack chicken wings were crispy and flavorsome. Vietnamese Seafood Platter was fresh and cooked perfectly with well seasoned scallops, clams, shrimp, and half lobster. BBQ Platter large had lots of grilled tasty pork skewers, spicy sausage, shrimp kabob, refreshing papaya salad, served over bed of rice and tasty dipping sauce. Will be back. Look forward to trying other items on the menu.', ""4.5 round up. \xa0It's a cute little family owned business. \xa0Very easy to order online and pick up.For our first time visit, we went big with the family meal and some more:Chicken 20 pieces (Volcano Hot + OG Krack)Wow. \xa0the volcano hot is hot. \xa0My hubster loves spicy but i think this was a bit too spicy and outside of his comfort zone. \xa0OG Krack is tasty. \xa0the kids liked it and not spicy at all.Hawaiian Shrimp (it already comes with rice so don't opt for more)BIG shrimp, shell on, light batter and very tasty. \xa0Lots of butter and garlic that taste amazing when stirred into the rice. yum!FriesCan't go wrong and what gives them the one-up bonus .... krinkle fries! yay!Vietnamese Seafood PlatterFun addition that's pretty to look at. \xa0Scallops on shell were pretty but kinda dinky. Half lobster was a good size. Pala equiv. More shrimp and clams and other fun bits.BBQ Pork SkewersTasty pork belly chunks with delicious lemongrass style seasoning. \xa0These were a hit and definitely get a large.Seafood Garlic NoodlesHELLLLA garlic which is YUMMMYYYY... definitely will be coming back for more of the garlic noodles. \xa0Loved this dish the most.Delicious food with a home cooked touch. \xa0It fed out family for a few days and we enjoyed every bit. Mango tea was sweet and a good palate cleanser after all the yummy food. Definitely recommend for the variety of fun eats and will be back to support. Check em out!"", 'I had no idea you guys were closing. I called to place an order earlier and got your vm. I will miss you guys!! Thank you for the delicious food this past year.Looking forward to supporting you at your new location (when known).', ""We ordered dan Dan noodles, Hawaiian shrimp, and wings (hmong fire and the OG crack) \xa0Dan Dan noodles were simple. Nothing to rave about. Portion was smaller than I thought it would be since the girl said it could feed two... maybe if it's a mother and child then yeah. Hawaiian shrimp was the best. Very flavorful. Wish you get more pieces of shrimp but would def order again. It's light and crispy. Don't usually like the skin but it's not noticeable here. Wings were good. Hmong wings are very spicy. Almost died a little. I have an average tolerance. It's very seasoned and the burn keeps going. The OG crack isn't on the menu but it's just a lot more garlic. It's pretty good. Nice and crispy."", 'We ordered 2 drinks. They came very way below the lids, but the juice is very fresh. We ordered 3 dishes: Dan Dan noodle - very intensely flavorful--rich in all sorts of umami goodness. Garlic noodle - unbelievable delicious with so much seafood. Very good with decent quantity of seafood like fresh clams and shrimps..Korean bulgogi-tenderness and delicious..', ""I have only tried the wings here, so this is a review of only that. I love the flavors they have however personally I find it overbreaded/overbattered. I don't know if this is a traditional thing or just their signature style and I understand if it is but I would love a lighter battered version/Non battered version.Tried these flavours and liked all: Original, Korean, Garlic Parmesan, Taiwanese 5 spice, Hmong. Want to try the other interesting things which are available only on weekends. Will update the review then."", ""Love love everything that they serve here. I can't even begin to describe each dish I've had because there's no point other than - just come and eat!! I AM SATISFIED! \xa0Their customer service is also awesome! Thank you so much for making my life so much better!"", ""If you want wings, order ahead of time. Arrived around 7pm on a Saturday night but it was 45 minutes to an hour wait for wings. I'll try it next time.Instead we got #3 Hawaiian Ono Shrimp (Garlic Lemon) and my girlfriend got #2 Korean Steak Bulgogi. #3 Hawaiian Ono ShrimpLarge sized shrimp, juicy, strong garlic/lemon flavor. Reminded me of the famous shrimp trucks in North Shore, Hawaii. If you know, you know.#2 Korean Steak BulgogiI kinda wish I had something else to go along with it. The takeout box has 3 pockets and one was empty. Feels like I'm missing out on something. We also added an egg on top for $1. I believe it was a runny egg but I think it cooked in the take out box on the way home. So if you add the egg, just know it won't be runny if you wait to eat it."", ""LOVED the sichuan spicy noodles (dan dan mian)!! \xa0I've ordered this dish at many chinese restaurants and I think this was my fave. It was super savory and delicious, with lots of ground meat and small pieces of veggies. Definitely not as sesame/peanuty as other places but I kinda liked it like this more! The noodles might've been a bit overcooked (lacked some chew) but the flavor was too good. I got a regular size and honestly the portion could've been bigger. My bf and I finished it easily.Also got the Hmong wings and the flavor was super unique. It was citrusy and spicy and I def felt the heat in my tummy. I do wish the wings stayed a bit crispier but still good!""]"
