id,alias,name,image_url,is_claimed,is_closed,url,phone,display_phone,review_count,categories,rating,location,coordinates,photos,price,hours,transactions,messaging,special_hours,reviews
xWqmcC9uVZ_giCib-89SFQ,nanays-best-bbq-san-diego,Nanay's Best BBQ,https://s3-media4.fl.yelpcdn.com/bphoto/MZn00FYktgvj4ZjmUA1JSQ/o.jpg,True,False,https://www.yelp.com/biz/nanays-best-bbq-san-diego?adjust_creative=PSmU_iV5giP-Cb4BnfhqTw&utm_campaign=yelp_api_v3&utm_medium=api_v3_business_lookup&utm_source=PSmU_iV5giP-Cb4BnfhqTw,+18586250827,(858) 625-0827,264,"[{'alias': 'bbq', 'title': 'Barbeque'}, {'alias': 'filipino', 'title': 'Filipino'}]",4.0,"{'address1': '6715 Mira Mesa Blvd', 'address2': 'Ste 103', 'address3': '', 'city': 'San Diego', 'zip_code': '92121', 'country': 'US', 'state': 'CA', 'display_address': ['6715 Mira Mesa Blvd', 'Ste 103', 'San Diego, CA 92121'], 'cross_streets': ''}","{'latitude': 32.9064147002979, 'longitude': -117.173668406904}","['https://s3-media4.fl.yelpcdn.com/bphoto/MZn00FYktgvj4ZjmUA1JSQ/o.jpg', 'https://s3-media2.fl.yelpcdn.com/bphoto/1sqan8wXe1qwHorvZrFFPw/o.jpg', 'https://s3-media4.fl.yelpcdn.com/bphoto/lajxWuowVIOSTRYeSoeFdQ/o.jpg']",$,"[{'open': [{'is_overnight': False, 'start': '1000', 'end': '1800', 'day': 0}, {'is_overnight': False, 'start': '1000', 'end': '1800', 'day': 1}, {'is_overnight': False, 'start': '1000', 'end': '1800', 'day': 2}, {'is_overnight': False, 'start': '1000', 'end': '1800', 'day': 3}, {'is_overnight': False, 'start': '1000', 'end': '1800', 'day': 4}, {'is_overnight': False, 'start': '1000', 'end': '1400', 'day': 5}], 'hours_type': 'REGULAR', 'is_open_now': False}]",['delivery'],,,"[""Huge portions! And delicious food of course. Great bbq pork and sisig. I really like the added spiciness in the sisig. Every Filipino makes it different and I think this is the best version of it.The lumpia could be kept in a warmer so they're served hot though. But lumpia is always good regardless because it's freakin' lumpia.Very low price for a huge portion of food. I always have half for lunch, half for dinner. Also very fast and friendly service."", 'Love their lunch options- combo or a la carte. Food is flavourful and service is great. Dont know all the names but the sesig, chicken curry, bbq chicken/pork, adobo, pancit all are great!', ""Great lunch spot in the area! Love the pork Sisig and Lechon. My two favorite combos! Sisig usually goes quick so next favorite item would be chicken curry. When I'm in the area and in the mood for Filipino food, this is my go to place."", ""Great spot for lunch! I got this 2 entree plate for ~$7-8. BBQ pork was yummy and I'd definitely order it again. Got the string beans to be a little healthy but it was actually a little oily. I got the fried rice but I think I'll get the white rice next time. The entrees had a lot of flavor so you don't really taste the fried rice anyways."", ""Great barbecue with generous servings!!! \xa0You'll have to try it... you'll like it!!!!"", ""One of my favorite places! It's one of the best hole in the wall fast food places you'll find around here. 100% delicious AF"", ""It was my first time trying this location last week! In the last week I have gone twice !!!!My favorite is their fried rice ! Probably the best I've had! For entrees I choose bbq pork & bbq chicken !!! They are sooo delicious ! It is a popular location , and food does run out ! Their portions and pricing is unbeatable ! Highly recommend !!"", ""Few places nowadays can match this place in terms of value and flavor. I was very surprised when I paid only $8.35 for a Togo box filled to the brim w rice and heaps of bbq and marinated chicken. They just kept loading the meat and I wasn't sure when they would stop lmao. Great portion size, affordable pricing, and good quality food makes for a great quick lunch if you're in the Sorrento area."", ""Pronounced Ny Ny's, which means mother in Tagalog, Nanay's Best BBQ is a little quick-service Filipino take-out sure to leave you full and happy. I say take-out but there is one or two tiny tables inside and a shared patio area outback.Located in Mira Mesa Blvd, near the 805 freeway, Nanay's is tucked in the same lot as Aldi, Subway, Santorini Grill, Waba Grill, Starbucks, and more! 01/2020So for $8.35 including tax, you can get a two item combo with your choice of rice, fried rice, or Pancit. And these combos are packed to the brim with your choice of entree's regularly including lechon, sisig, beef caldereta, bbq pork, bbq chicken, chicken wings, and more. You can also get 3 different sized entree portions (s,m,L) if you don't need the rice/Pancit/etc. I highly recommend the bbq chicken and BBQ pork with fried rice. The fried rice has plenty of garlic which I absolutely love. There's also lumpiaThis place can get a line out the door but since the food is already prepared, it's quick to get in and out.They also have a few Filipino desserts including Toron, banana lumpia.Nanay's is sure to satisfy your palette and keep you full for the afternoon! Enjoy! Salamat Po!"", ""If you're new to Filipino food, i'd recommend getting the BBQ chicken and BBQ pork with the fried rice.I've tried a few other dishes and they tasted very homemade. \xa0It's not a bad thing, i just felt like those dishes were meant for people who grew up with it.The lechon unfortunately was too hard for me. \xa0I felt like i could break a molar trying to eat the lechon here. \xa0Maybe it was a bad day but i haven't had a chance to go back on a thursday. Overall, i still like this place and would recommend.""]"
_T88LJN8whEPe6uovSsb0g,yakyudori-san-diego,Yakyudori,https://s3-media3.fl.yelpcdn.com/bphoto/SPSDwk1DKo6jziObFtwBWw/o.jpg,True,False,https://www.yelp.com/biz/yakyudori-san-diego?adjust_creative=PSmU_iV5giP-Cb4BnfhqTw&utm_campaign=yelp_api_v3&utm_medium=api_v3_business_lookup&utm_source=PSmU_iV5giP-Cb4BnfhqTw,+18582682888,(858) 268-2888,1985,"[{'alias': 'ramen', 'title': 'Ramen'}]",4.0,"{'address1': '4898 Convoy St', 'address2': 'Ste 101', 'address3': '', 'city': 'San Diego', 'zip_code': '92111', 'country': 'US', 'state': 'CA', 'display_address': ['4898 Convoy St', 'Ste 101', 'San Diego, CA 92111'], 'cross_streets': 'Ronson Rd & Raytheon Rd'}","{'latitude': 32.8305462783919, 'longitude': -117.153696253781}","['https://s3-media3.fl.yelpcdn.com/bphoto/SPSDwk1DKo6jziObFtwBWw/o.jpg', 'https://s3-media2.fl.yelpcdn.com/bphoto/BU4UirR4Lbp4uHS7Yei6fA/o.jpg', 'https://s3-media3.fl.yelpcdn.com/bphoto/NcEn9nqH4Vt9Lx9WRLKtog/o.jpg']",$$,"[{'open': [{'is_overnight': False, 'start': '1130', 'end': '1400', 'day': 0}, {'is_overnight': False, 'start': '1630', 'end': '2200', 'day': 0}, {'is_overnight': False, 'start': '1130', 'end': '1400', 'day': 1}, {'is_overnight': False, 'start': '1630', 'end': '2200', 'day': 1}, {'is_overnight': False, 'start': '1130', 'end': '1400', 'day': 2}, {'is_overnight': False, 'start': '1630', 'end': '2200', 'day': 2}, {'is_overnight': False, 'start': '1130', 'end': '1400', 'day': 3}, {'is_overnight': False, 'start': '1630', 'end': '2200', 'day': 3}, {'is_overnight': False, 'start': '1130', 'end': '1400', 'day': 4}, {'is_overnight': False, 'start': '1630', 'end': '2200', 'day': 4}, {'is_overnight': False, 'start': '1130', 'end': '1400', 'day': 5}, {'is_overnight': False, 'start': '1630', 'end': '2200', 'day': 5}, {'is_overnight': False, 'start': '1130', 'end': '1400', 'day': 6}, {'is_overnight': False, 'start': '1630', 'end': '2200', 'day': 6}], 'hours_type': 'REGULAR', 'is_open_now': False}]","['delivery', 'pickup']",,,"['Outstanding! The food here is so amazing.The Spicy Tonkostu Ramen was tasty and filling. The broth was so delicious and the right amount of spicy. The Steamed Pork Dumplings were perfect, I loved the dipping sauce that came with them. The Pork Belly Yakitori took a little long to come out but it was great. The Kanazawa Curry Rice Deluxe was shockingly amazing. Every bite of that dish was incredible and so worth the price. I loved the Fried Chicken Wings; I want to say we got the original seasoning or whatever the house seasoning was. My absolute favorite item was the Grilled Whole Squid. It was a huge portion and cooked perfectly.This spot totally looks like a hole in the wall and can be easily overlooked. It is really really great. There is plenty of parking and a Starbucks right next door.', ""Have been to this place and gotta say their food is good and very affordable! However, I remember last year, we weren't let in because of my partner's service dog. He has epilepsy and is always with his service dog. We explained that it's not a pet, but a service animal but they refused to let us in so we just left. Have never gone back since."", ""Went out with some friends for dinner and we weren't originally planning on coming to Yakyudori, but given a few issues (it being a weeknight, a lot of restaurant hours being adjusted due to COVID, and not having a reservation), we ended up here. Honestly, I'm quite surprised that we were able to make it into Yakyudori since they're usually pretty busy. I ended up ordering the Chicken Katsu Bowl which was good. You get pretty big pieces and the breading is very crispy. I've gotten this dish in the past as well and my only issue would be that they sometimes skimp on the mayo. They charge extra if you want more, and given the size of the chicken pieces, it'd be nice if they offered a little more of it since it can get a bit dry in texture without it. I usually don't have this issue when ordering Chicken Katsu or Karaage Dons at other restaurants. During my most recent visit, I also got to try their Pork Shiso and Bacon Wrapped Asparagus Skewers. Both were delicious and cooked nicely. The Pork Shiso definitely has a prominent basil taste so keep that in mind if you're planning on ordering it. I've also tried their Pork Belly and Beef Skewers in past visits which were pretty good as well. For the Beef skewer, it isn't the best quality beef I've tried, but it's always cooked very well. \xa0Overall, Yakyudori isn't my favorite Japanese restaurant in the area, but it is still a solid option. They have a pretty big menu so I'm interested in trying more dishes in the future as well!"", ""Cute little restaurant in the Claremont area. Food was very good.Came here one night for dinner and it was a very nice experience. It was a small but super cute little restaurant ran by what I presume is a family. They have an extensive menu with lots and lots of choices. And it was quite busy when we went apparently this place is pretty popular with the locals.We ordered a bunch of items to share including a bowl of Ramen and some appetizers. Everything was extremely tasty and delicious. The miso Burger was some thing we didn't expect to be amazing. Must order. Very interesting combination of flavors.Overall a super nice experience, the service was very nice and friendly. The only thing I would say is it could be slightly cleaner."", ""Came here during dinner time hoping to try yakitori for the first time. We got sat down after 20 minutes and the waitress took our order and missed two of the items we ordered. The food came out one by one (every 15 min for 1 plate of skewers) for our party of 5 and we were sitting waiting for over an hour and a half. We also ordered the steak salad which ended up being a few pieces of beef, a thin layer of greens and a heaping portion of just rice. The food is decent but portions are incredibly small and overpriced. They also don't itemize your bill and charged us for something we didn't order."", 'I really enjoyed my chicken katsu don. The chicken had a thin layer of crisp panko breading and was not oily and the meat was not dry. I like how they thinly sliced the green onion (though I am not a fan of raw green onion and did not eat it) -- the sign of a true chef in the kitchen. This was one of the best chicken katsu dons I have ever had. I would definitely recommend it.I was a bit surprised there was only one fried soft shell crab in the order for $7.50 but it is seafood after all so I should have expected it. In contrast to the small amount of crab, there was a large amount of sides (daikon, sauce, lettuce). The crab was crispy and true to the soft shell crab name, it was easy to eat shell and all. It was good but at $7.50, it was a bit pricey for a small snack.The amount of food was more than enough for me but I notice their portions are a bit small. I would suggest ordering a bit more than normal. I am not sure if their portions are small because COVID has hit all the restaurants hard and they have to keep their prices down or if they were always small.I enjoyed my meal and would come back to support them again!', 'Came here with my bf because I was craving takoyaki and San Diego seems to have a shortage of spots for some. We were also very impressed by the shio ramen! The broth is light and flavorful and the noodles were cooked just the way I like them. Would definitely recommend and come back.', ""Omg where have I been?! How am I just now trying this place?! My husband & I have had a favorite Japanese joint & always went there. Unfortunately our usual spot is temporarily closed due to covid, so we had to look else where for take out and found yakyudori. Wow blows out our old favorite, will go here from now on. So thankful they're still open for take outs so I can get my Japanese cravings fulfilled during these covid times. The items I ordered:Karage, fried chicken: crispy, tender, delicious. Pork belly skewer: simple, but smoky & delicious. I wanted to try their beef, but my cheap ass didn't want to pay the $7.50 for 2 skewers. Bbq pork bowl: a little sweet, a little savory, with browned & crispy pork pieces, drizzled with corn & Mayo on top, a few shredded cabbage. Loved this. So good. Great portion size! Gyudon beef bowl: the best gyudon I've tried so far in San Diego because of the meat ratio. They are not stingy with the meat like most restaurants are. It's usually a thin layer of meat on top with with a ton of rice in other places I've tried. Not here at yakyudori! They put a ton of the thinly sliced beef, I mean look at my pictures below. Great portion size too, my husband was so full & barely finished it. This will now be our go to when we're craving Japanese. Our new favorite spot. I'm looking forward to trying their ramen next time. My only request if the owner reads this, please add shrimp & veggie tempura to your menu. Unless I'm blind, but I couldn't find it on the menu."", '4-15-21Niece came into town, decided to come back to Yakyudori since it\'s close to home....Was not disappointed. \xa0Japanese Food is our soul food. \xa0We know what to expect. \xa0Happy they are still in business and survived Covid19.Masks required then, not while seated. \xa0One thing you must know about this place, is that it\'s really small. \xa0However the service is fast. \xa0The food is hearty.We ordered:Spicy Tonkotsu RamenShoyu RamenPork Shiso SkewersMoMo (Chicken Thigh) SkewersGarlic SkewersWe both left happy. \xa0My niece has never had the Yakitori or Pork Shiso. \xa0She was very happy.....All in all, if you catch this place at a good time with minimal wait you\'re lucky. \xa0It\'s always busy. \xa0But the ramen hits the spot. \xa0You can\'t go wrong coming here for the food. \xa0Living and working in Japan, I\'ve experienced better. \xa0But for my neighborhood ramen house, it is one of my ""go to places.""', ""Good Ramen but man the profit margin must be tight! \xa0Got 4 itty bitty pieces of fried squid in our take out order and it's the smallest ramen I've had. \xa0Ever.""]"
8rhPTmKSFtKHQFJCcwJcgw,sue-s-korean-kitchen-san-diego,Sueâ€™s Korean Kitchen,https://s3-media4.fl.yelpcdn.com/bphoto/WH4mb928CZ95ctpO4keYsg/o.jpg,False,False,https://www.yelp.com/biz/sue-s-korean-kitchen-san-diego?adjust_creative=PSmU_iV5giP-Cb4BnfhqTw&utm_campaign=yelp_api_v3&utm_medium=api_v3_business_lookup&utm_source=PSmU_iV5giP-Cb4BnfhqTw,+18583526511,(858) 352-6511,58,"[{'alias': 'korean', 'title': 'Korean'}]",5.0,"{'address1': '6755 Mira Mesa Blvd', 'address2': 'Ste 109', 'address3': None, 'city': 'San Diego', 'zip_code': '92121', 'country': 'US', 'state': 'CA', 'display_address': ['6755 Mira Mesa Blvd', 'Ste 109', 'San Diego, CA 92121'], 'cross_streets': ''}","{'latitude': 32.906204962596696, 'longitude': -117.17374027302895}","['https://s3-media4.fl.yelpcdn.com/bphoto/WH4mb928CZ95ctpO4keYsg/o.jpg', 'https://s3-media4.fl.yelpcdn.com/bphoto/D0qM9CHrEOUoMP0oJGWWUQ/o.jpg', 'https://s3-media2.fl.yelpcdn.com/bphoto/vUUiV7eouD2wmv1lpi8RJg/o.jpg']",,"[{'open': [{'is_overnight': False, 'start': '1000', 'end': '2100', 'day': 0}, {'is_overnight': False, 'start': '1000', 'end': '2100', 'day': 1}, {'is_overnight': False, 'start': '1000', 'end': '2100', 'day': 2}, {'is_overnight': False, 'start': '1000', 'end': '2100', 'day': 3}, {'is_overnight': False, 'start': '1000', 'end': '2100', 'day': 4}, {'is_overnight': False, 'start': '1000', 'end': '2100', 'day': 5}], 'hours_type': 'REGULAR', 'is_open_now': False}]",[],,,"['Kimbap rolls were delicious and well priced I would say! Super duper nice lady I would come back just for her haha.', 'Kimchi fried rice tastes so good!!! the lady is so so sweet. 10/10 customer service, 10/10 food, and 10/10 energy :)', 'Delicious Korean food, generous portions, and friendly staff.Ordered the beef bulgogi and got 1 full takeout container that was just meat, and another with rice and banchan (fish cake, daikon, kimchi). Excited to come back and try other dishes! They also have a fridge stocked with side dishes that would put HMart to shame.', ""I was looking for an easy, but delicious place to grab lunch in Mira Mesa today and stumbled upon this on Yelp. I'm so glad that I went to try it. This is an actual hole in the wall, mom and pop Korean spot and it was exactly what I was craving. I ordered the kimbap and cup bap (bibimbap) with beef. Everything was so fresh and affordable, and the people working there are so nice! They also have fridges with kimchi and additional ban chan (side dishes) for you to purchase as well. I'm looking forward to coming here many more times and trying even more on the menu!"", ""After reading all the good reviews for this place, I was really excited to try it. This place is such a cute mom and pop shop. The food tastes like you are eating something someone's mom made. The portions are huge and cheap! You will not leave feeling hungry.We came for lunch and ordered the beef cup bap and the kimbap. Both were delicious and are a lot more food than it looks like in the photo. It is a great lunch option if you do not want to feel too full or sluggish after eating. I will definitely be back to try more of the menu."", ""THE hole in the wall place for all your korean food!! Just stumbled upon this place on my yelp and was so excited to go I went to pick up some take out for dinner. Ordered the samgyetang (chicken soup) and soondubu (tofu soup) and picked up kimbap, squid side dish, and beef/eggs from the fridge. They have a large refrigerator that has a variety of side dishes and kimchi! My boyfriend commented that they have literally everything (hes korean so if you don't trust my opinion that's authentic AF, trust his ). Food was ready in very quickly !! (5-10 mins)Samgyetang has a very mild flavor soup wise so I added a little bit of salt when I got home but it's very soothing and the kind of home food you crave when you're feeling under the weather. The soup has a whole chicken that is stuffed with glutinous rice and other fillings.Soondubu is less spicy than other korean restaurants like Tofu House (which is apparently more authentic ??) and had a variety of proteins (some seafood and ground beef). Would highly recommend this place for great korean food to take home!!"", ""This spot is very small Korean shop that really yells an adjumma shop! They have refrigerators that are filled with different types of Korean side dishes, soups and even pork feet trotters. I usually come here for their gimpbap or kimbap(Korean sushi rolls). The portion sizes are two long rolls for only $8 and they make it fresh to order. The are usually filled with different veggies and fish cake. I would recommend calling in the order if you can because I think this is a small mom and pop shop and they don't seem to have many workers. They do get busy during lunch."", ""I detected the delicious scent of beef charing on the grill as I waited for my order. \xa0 \xa0The styrofoam container could not keep the scent contained. \xa0I breathed in the scent as my HR-V now smelled like Korean food. \xa0Scent filled my home as I opened up the container to eat. \xa0Galbi was tender and juicy with delicious flavor. \xa0When I was ordering I tried to swap my sides for extra rice but instead I wound up with an extra strip of beef with no rice or sides. \xa0I loved the extra meat but next time I'll try to get it with rice and no sides.2nd visit I tried the beef gulgogi with rice. \xa0Rice was fresh out of the huge rice maker. \xa0Delicate and moist. \xa0Bulgogi was tender and bursting with flavor. \xa0Great tasting meal.3rd visit I tried the fried dumplings. \xa0Thin won ton wrapper was crunchy while the tender pork and cabbage filling was a nice contrast in texture. \xa0I loved the flavor of the fried dumplings.Owner was nice and was hard at work doing almost everything. \xa0Looked like there was a cook helping in the kitchen. \xa0Cool family run business with great tasting Korean food."", 'I adore this place!!! The food is delicious and comforting and the woman at the register (who I am to assume is Sue) is wonderfully kind and charming. They are take out only but I would have loved to dine in if that was a possibility.Regardless, the food was fantastic after being taken home. We got the kimbap, bibimbap and samgyetang (ginseng chicken soup). Good size portions and everything was so fresh. The soup may be my favorite, I felt healed drinking it. Just remember to add salt and pepper to your taste for perfection!', ""Nice cute small business. Their food is also really good! Feels like I'm eating authentic home cooking from a Korean mom!They were all really sweet and so happy, it definitely brightened my day. They serve their food with sides and don't hesitate on portions!I had a great experience overall, and I'm definitely keeping this restaurant saved! Nothing better than finding small gems like these!""]"
