id,alias,name,image_url,is_claimed,is_closed,url,phone,display_phone,review_count,categories,rating,location,coordinates,photos,price,hours,transactions,messaging,special_hours,reviews
h0eABYb0d0BS4n5WVl5YTw,ichizen-sushi-and-japanese-cuisine-poway,Ichizen Sushi & Japanese Cuisine,https://s3-media2.fl.yelpcdn.com/bphoto/8TSF_qAkyiOPdPdtex2S0A/o.jpg,True,False,https://www.yelp.com/biz/ichizen-sushi-and-japanese-cuisine-poway?adjust_creative=PSmU_iV5giP-Cb4BnfhqTw&utm_campaign=yelp_api_v3&utm_medium=api_v3_business_lookup&utm_source=PSmU_iV5giP-Cb4BnfhqTw,+18584864558,(858) 486-4558,398,"[{'alias': 'japanese', 'title': 'Japanese'}, {'alias': 'sushi', 'title': 'Sushi Bars'}]",4.0,"{'address1': '13307 Poway Rd', 'address2': '', 'address3': '', 'city': 'Poway', 'zip_code': '92064', 'country': 'US', 'state': 'CA', 'display_address': ['13307 Poway Rd', 'Poway, CA 92064'], 'cross_streets': 'Community Rd & Bowron Rd'}","{'latitude': 32.9559077802006, 'longitude': -117.042584809956}","['https://s3-media2.fl.yelpcdn.com/bphoto/8TSF_qAkyiOPdPdtex2S0A/o.jpg', 'https://s3-media2.fl.yelpcdn.com/bphoto/YD1by8NelvO4lXzlP8EgrQ/o.jpg', 'https://s3-media1.fl.yelpcdn.com/bphoto/qnrmN-mR7HRPoht7Uxe5Sw/o.jpg']",$,"[{'open': [{'is_overnight': False, 'start': '1100', 'end': '2000', 'day': 0}, {'is_overnight': False, 'start': '1100', 'end': '2000', 'day': 1}, {'is_overnight': False, 'start': '1100', 'end': '2000', 'day': 2}, {'is_overnight': False, 'start': '1100', 'end': '2000', 'day': 3}, {'is_overnight': False, 'start': '1100', 'end': '2000', 'day': 4}, {'is_overnight': False, 'start': '1130', 'end': '2000', 'day': 5}, {'is_overnight': False, 'start': '1130', 'end': '2000', 'day': 6}], 'hours_type': 'REGULAR', 'is_open_now': False}]",['delivery'],,,"['This is a family run Japanese restaurant. We always have a consistent serving for the bento or bowl and tempura.For the price and food itself, this place is a gem in Poway.', ""I love it when I can try out a small business in Poway and actually like the food. Please continue to support your local small business!I actually never knew this place existed. It's wedged between Five Guys and Little Ceasars. What attracted me was the oversized big banner that referenced 19% off entire bill.I ordered for pick up: Tonkotsu ramen ($11.48), shrimp tempura udon ($10.98), and a lunch bento box that came with rice, salad, miso soup, 2 piece CA rolls, 4 tempura, 2 gyoza, a small drink and a protein ($9.98). I got chicken teriyaki.They packaged the bag very tightly and neat. I was afraid of the udon and ramen broth spilling but they put a small piece of card board at the bottom of the bag for support.The udon and ramen noodles where kept separately in a container and the broth was still super hot. Both broths were good but udon tasted like what you can make from the store. The tonkotsu broth was yummy and creamy. The ramen was tasty and had texture and chewy. I would order the ramen again but the udon. The bento box was well worth the price. I wish the chicken had more teriyaki drizzle because it was a bit dry. Can't go wrong with tempura and they gave a huge container of sauce to dip. It was all veggie but the udon came with one shrimp tempura. I was also surprised that the lunch bento prince was offered on a weekend.Please don't forget to tip more since 19% discount was given."", ""Lovely little family restaurant with delicious Japanese food at extremely reasonable prices. This has become my local go-to for bentos, sushi, and udon. They have a great menu with lots of cooked and raw items, and when you order to-go they take extra care in packing things in a way that preserves the quality of the food. Even in the takeout boxes there is thought in presentation, and that gets major bonus points from me. We eat with our eyes before our mouths! So far we've gotten sushi rolls, appetizers, bento boxes, and udon. Every item has been super tasty and prepared perfectly. The rice is deliciously sticky and chewy, the teriyaki is grilled well, and the sushi is fresh. Like I mentioned above, it's all priced well too! My hubby and I got a very satisfying dinner for $20 total. I will continue to eat my way through their menu any chance I'm craving Japanese food!"", ""I'm sorry to say We did not have a good experience. The noodles looked like angel hair pasta in our yakisoba, an entire person's order was missing, one of our orders looks like half had been taken out, and the gyoza looked like something from a frozen package. We were really disappointed due To hearing good things about this place. Perhaps it was an off night but overall we were disappointed across-the-board - especially for the price!"", ""Even during the pandemic, the food is still awesomesauce at this mom and pop Japanese restaurant tucked away in Poway.We arrived for a late lunch on a Sunday afternoon. Take out and very limited outdoor dining are the only options available as of my visit.Dine-in service is limited to three outdoor tables that are properly spaced apart under tarps set up in the parking lot right in front of the restaurant. Despite the limited dining space, it is actually a nice outdoor set up so as long as SoCal is not having a heatwave.Customers can still enter the shop to place and pickup take out orders.Customers who elect to dine-in must also place their order inside and pay for it before stepping back outside to sit down at any available table.I should note that the restaurant is offering a 19% discount off their standard menu prices! I was shocked how small my total order came out to be (which I essentially gave right back as a tip).Here's what I ordered:- Sukiyaki Beef Bento- Chicken Katsu Bento- Takoyaki (4)- Shrimp Tempura- Caterpillar Rollthe nice lady who took your order rushes out with the same cart they used to use inside the restaurant to serve food. Everything is packaged as if it is for take out and handed to you on a tray.I'm not even going to review the food because all of it was the same quality as usual--which is awesome! Sadly, the presentation is not ideal because everything is (carefully) packaged as if it is ready for take out, but all the usual quality is still there.After your party leaves, the nice lady who took your order rushes out to clear things off and disinfects the table for the next group.Keep in mind this restaurant is not a chain. This is a real mom and pop joint still serving good eats.Come on out if you're in the area and want some good Japanese served up with a 19% discount! The food here always reminds me of my time in Japan...that's how legit I think it is."", 'This place has a really large menu. You can can yakisoba (fried thick noodles), udon (soup noodles), bento boxes, sushi, nigiri (larger piece of meat on top of packed rice). I would order sushi more as appetizer here and add other items. What did I order? Creamy spicy roll, spicy yellowtail, salmon and ahi tuna sushi. All were delicious. I will come back and try more items, I have a feeling I will be bumping up the score to 5 stars if I try things other than the sushi.Quality - goodSize - sushi is really small compared to other places, so order moreSpeed - pretty fast 10 min wait for take out near closing timePrice - excellent, around $30 for two as a snack', 'Price was very reasonable and the salmon & chicken teriyaki bento box was very tasty.The owner was offering the discount since we all having a hard times due to Covid 19.Appreciate it. I respect the businessman ship. Will definitely come back again.', ""First time, and this might already be my go-to Japanese restaurant. Very affordable. \xa0Wonderful quality.Teriyaki chicken bento box. That was one really well made bento box. \xa0Oh man the care they put into each of the dishes was amazing - even now with covid just as take-out!I can't wait to come back and try more of their food!"", ""Authentic! \xa0So cute and polite lady. \xa0Orders are correct all the time. \xa0Food is delicious and prepared beautifully and clean! \xa0The rice is always perfect- not hard, not dry, not mushy but just right holding shape and fresh. \xa0I always get the the Salmon Teriyaki Bento. \xa0We keep coming weekly for small business support, great service pre & post pandemic. \xa0Can't wait to eat inside again. \xa0These owners work so hard and deserve all the best. \xa0I see they take pride in food prep and service! \xa0Thank you."", 'Great bento boxes at a reasonable price. Comes with a drink(I recommend the ice tea) Miso soup, and dipping sauce for the tempura vegetables. I had my son pick these up during our Covid19 lock down. What a nice, healthy, complete meal. So grateful!']"
iPBiV0NN0R_Jch7mGYuK_w,ai-sushi-and-teriyaki-poway,Ai Sushi & Teriyaki,https://s3-media1.fl.yelpcdn.com/bphoto/e1B3kaxYE2MYbQOkephX8g/o.jpg,True,False,https://www.yelp.com/biz/ai-sushi-and-teriyaki-poway?adjust_creative=PSmU_iV5giP-Cb4BnfhqTw&utm_campaign=yelp_api_v3&utm_medium=api_v3_business_lookup&utm_source=PSmU_iV5giP-Cb4BnfhqTw,+18583809960,(858) 380-9960,65,"[{'alias': 'sushi', 'title': 'Sushi Bars'}]",4.5,"{'address1': '12205 Scripps Poway Pkwy', 'address2': None, 'address3': '', 'city': 'Poway', 'zip_code': '92064', 'country': 'US', 'state': 'CA', 'display_address': ['12205 Scripps Poway Pkwy', 'Poway, CA 92064'], 'cross_streets': 'Kirkham Rd & Pomerado Rd'}","{'latitude': 32.934179, 'longitude': -117.062441}","['https://s3-media1.fl.yelpcdn.com/bphoto/e1B3kaxYE2MYbQOkephX8g/o.jpg', 'https://s3-media4.fl.yelpcdn.com/bphoto/pUVsek6qXTJFmXNju3EFTg/o.jpg', 'https://s3-media3.fl.yelpcdn.com/bphoto/V_naypemX1k64mDX2cf7YQ/o.jpg']",$,"[{'open': [{'is_overnight': False, 'start': '1100', 'end': '2100', 'day': 0}, {'is_overnight': False, 'start': '1100', 'end': '2100', 'day': 2}, {'is_overnight': False, 'start': '1100', 'end': '2100', 'day': 3}, {'is_overnight': False, 'start': '1100', 'end': '2130', 'day': 4}, {'is_overnight': False, 'start': '1100', 'end': '2130', 'day': 5}, {'is_overnight': False, 'start': '1100', 'end': '2130', 'day': 6}], 'hours_type': 'REGULAR', 'is_open_now': False}]","['delivery', 'pickup']","{'url': 'https://www.yelp.com/raq/iPBiV0NN0R_Jch7mGYuK_w?adjust_creative=PSmU_iV5giP-Cb4BnfhqTw&utm_campaign=yelp_api_v3&utm_medium=api_v3_business_lookup&utm_source=PSmU_iV5giP-Cb4BnfhqTw#popup%3Araq', 'use_case_text': 'Message the Business'}",,"[""This place hits the spot. Great quality fish and generous in their rolls and nigiri pieces. For nigiri - Salmon is my favorite here. For rolls - Spanish, hot lips (if you like something a bit spicier)They have great attention to detail. They don't put wasabi in the middle of their nigiri as it is a more traditional way to eat sushi, and I guess a good amount of their guests don't like it. One of the chefs saw me put wasabi between my nigiri, he remembered, and asked me if I wanted it inside the next time I came in. I did speak with him for a bit on our first visit as well. Very friendly and cares about their quality. Definitely a new go to spot for us."", ""We came back to take advantage of the special: buy 3 rolls, get 1 free. \xa0Everything was super delicious. \xa0My kids were so hungry, they gobbled everything up quickly. \xa0The waitress and sushi chef remembered us for dining here twice this week. \xa0The sushi chef, I assume is also the owner, came out to say hi to us, which we thought was a good gesture. \xa0If we happen to move to the area, this place will be our regular place to go to for sushi rolls. \xa0Give this place a shot! \xa0You won't regret it!"", ""Short story: \xa0We had a great Valentine's dinner here. Super nice people, excellent service, tasty food (monkey balls - yum!), reasonable prices and very clean. You can tell they care about their business and their customers and want to deliver quality on everything. Five stars for all these reasons.Long story: \xa0We're not usually in favor of dining out on Valentine's Day, but hubby and I had a craving for sushi Sunday night and ventured out for dinner at around 7:30pm - not unreasonably late for dinner normally, but in California COVID world, I guess it was too much to ask. Ai Sushi wasn't originally on our radar because we have a couple of other places closer to our house, but their hours and/or customer service were seriously lacking. (I won't name the offenders, but Carmel Mountain Ranch and RB were not up to par.) Who closes at 8pm on Valentine's night? Well, it's their loss because we had the best dinner at Ai Sushi!I'm so happy we discovered them in our Yelp search although I must warn, they still seem to be having some phone issues, so we almost didn't make it there, but don't give up! Website said they were open until 9:30, so to avoid more disappointment, we wanted to verify and called the Chevron station across the parking lot to ask if he would be so kind to tell us if the restaurant was open. (Five star review coming for them next.) The answer was yes!Arrived at around 8:30 and were seated right away underneath a nice outdoor heater. We were promptly given menus and were asked about drinks. After ordering, another server came out to ask us about drinks. Always nice to get extra service and I thought the self-serve water was a nice touch. Hubby's pet peeve is to have to wait for a water refill which sometimes never comes, plus they were super busy so this was perfect.Although it didn't seem like a long wait, they were very apologetic that they were having a hard time keeping up with orders and delivery so they brought us a seaweed salad on the house. The rest of our meal came shortly thereafter and we enjoyed everything. Monkey balls - amazing! Philadelphia roll - very good, but same as anywhere else. Jessica Alba - good and spicy, but a little too heavy on the onions. Pokie roll - fresh and delicious, this one was our favorite! We will be back soon to try more!"", ""I had to wait on my review until I've tried this place multiple times, and I'm here to say it's worthy!! Fresh sushi with fast service."", ""Love this place! Always great food and service to match. We live that it's located in our neighborhood!"", 'Our new favorite sushi spot!! Never disappoints!! Oh and the garlic edamame is aaaaaaamazing!!!', 'Very small, friendly place. Great sushi. They had a deal of buy 2 rolls of sushi get one free. Because of Covid, I he seating inside is limited, but they do take out and we saw a lot of ppl come to pickup orders. Bf got the hamachi kama. It was a nice crispy, not over cooked crispy. It was so good. We ordered the crunchy roll, Jessica Alba roll and the albacore special roll. My favorite was the albacore special roll. Will definitely be back.', ""This has been my go to sushi spot recently. They have a buy two get one free roll promo going on everyday so it makes it worth getting the three rolls. The amazing dragon is my favorite roll so far. I've tried most of the rolls and they all are pretty good. The service is pretty good. I just order ahead and pick up. It usually takes less than 30 minutes. If it's busy then maybe it's closer to 30. If you're in the Scripps Poway area and are craving sushi, come check this place out."", ""AI sushi replaced the neighborhood fan fav of Ikura. \xa0 The decor is updated and fresh. \xa0We liked the clean contemporary interior design. \xa0The restaurant has upbeat pop music playing in the background. \xa0We liked it.The place is relatively small but can still seat several separate groups under the new Covid mandates. \xa0The sushi here is good and well made by their chef. \xa0The menu is simple and easy to read. \xa0I wish the menu had a couple more creative tuna based rolls, but I'm sure they could make any special request rolls. \xa0The restaurant has a great sushi deal right now which is buy 2 rolls and get a third free roll. \xa0It's a great value. \xa0You've got to try it. \xa0This place has quality sushi and Japanese food. \xa0We have ordered in person, for take out and via Uber eats. \xa0This place is consistently good quality food. \xa0Welcome back AI sushi!"", 'DINE IN YELP EXPERIENCE - 6/5/20I had came across this restaurant randomly through while skimming yelp. Was curious to try a new restaurant which had its grand opening during Covid19. Upon entering, we waited at the entrance at restaurant. They had a promotion of buy 2 rolls get 1 free.We were given hand sanitizer and then got our temperature checks. Then we were told to sit anywhere available. For areas that they tried to keep social distancing, they had a handmade sign that said ""Sorry no service."" Outside before entering, you have to enter with a mask or face covering.Rolls we ordered-Crunchy Spicy Tuna: my staple favorite.Volcano Roll: Mr. W\'s favorite. He likes the combination of the mixed sashimi, imitation crab with the salmon on the outside along with the sauce. Hercules Roll: We weren\'t too big a fan. It was wrapped in cucumber, and I think the cucumber overwhelmed everything else within.Sushi rice seemed like it was fresh out of the rice cooker. It didn\'t seem like the usual sushi rice, but still tasted good. Service was a bit slower as only one waitress. I think they just started dine in and they\'re a pretty new restaurant. Would come again.']"
L2P1X4LrJ1VSqZo86qJU6A,rice-chicken-san-diego-2,Rice Chicken,https://s3-media1.fl.yelpcdn.com/bphoto/RX1nFH3LfnimtP3EX0yySw/o.jpg,True,False,https://www.yelp.com/biz/rice-chicken-san-diego-2?adjust_creative=PSmU_iV5giP-Cb4BnfhqTw&utm_campaign=yelp_api_v3&utm_medium=api_v3_business_lookup&utm_source=PSmU_iV5giP-Cb4BnfhqTw,+18583657447,(858) 365-7447,351,"[{'alias': 'chickenshop', 'title': 'Chicken Shop'}, {'alias': 'korean', 'title': 'Korean'}, {'alias': 'chicken_wings', 'title': 'Chicken Wings'}]",4.0,"{'address1': '13219 Black Mountain Rd', 'address2': 'Ste 7', 'address3': None, 'city': 'San Diego', 'zip_code': '92129', 'country': 'US', 'state': 'CA', 'display_address': ['13219 Black Mountain Rd', 'Ste 7', 'San Diego, CA 92129'], 'cross_streets': 'Twin Trails Dr'}","{'latitude': 32.9584533, 'longitude': -117.126813}","['https://s3-media1.fl.yelpcdn.com/bphoto/RX1nFH3LfnimtP3EX0yySw/o.jpg', 'https://s3-media2.fl.yelpcdn.com/bphoto/etCXs9Z9FDGZyOo19Li0bQ/o.jpg', 'https://s3-media3.fl.yelpcdn.com/bphoto/m49-URnYFXPbrpILqEjQIg/o.jpg']",$$,"[{'open': [{'is_overnight': False, 'start': '1100', 'end': '2030', 'day': 0}, {'is_overnight': False, 'start': '1100', 'end': '2030', 'day': 1}, {'is_overnight': False, 'start': '1100', 'end': '2030', 'day': 2}, {'is_overnight': False, 'start': '1100', 'end': '2030', 'day': 3}, {'is_overnight': False, 'start': '1100', 'end': '2030', 'day': 4}, {'is_overnight': False, 'start': '1100', 'end': '2030', 'day': 5}, {'is_overnight': False, 'start': '1100', 'end': '2030', 'day': 6}], 'hours_type': 'REGULAR', 'is_open_now': False}]","['pickup', 'delivery']",,,"['Great service~ Great Wings~ Great crunch~ Loved the slightly sweet, very spicy Volcano sauce. Next time I want to try the Cajun fries~ as Cajun is my favorite style of food aside from Szechuan/Hunan/ChongqingRestroom is open YaYWould definitely return', 'I\'d rate it more a 2.5/5.Food:We ordered the Number 8, half original spicy chicken and half marinated chicken in sweet and spicy, $29 before tax for 10 pieces mixed chicken fried using rice flour. Basically a whole fried chicken with sauce on the side, to maintain the crispy skin.The chicken was very crispy, but also very DRY especially the breast. This was probably due to the fact that it was reheated, more about that in the service section. There was nothing spicy about their chicken as well.The sides were cole slaw and pickled radish, both lightly dressed and crunchy. The sweet and spicy sauce was just a quite thick sweet syrup, again no heat detected; it reminded us of a chicken katsu dip rather than a sweet chili dip.Probably won\'t give them another try. For this price, we would rather go out of our way back to Bonchon. The chicken, service, and fixings are much much better in our experience.Service:We called in our order ahead of time, 5:30pm, to avoid having to wait for our food to cook. We set up a pick up time of 7:15pm, and was doubly confirmed by the gentleman on the phone. We get there at 7:10pm to pay and get the food, and the young man states, ""the food has been sitting here 10 minutes and is soggy, would you like us to reheat."" Why would it be ready that much ahead of time? I requested a fresh batch and willing to wait, but another man with colored hair denied doing so, stating that the food was only sitting for two minutes. Two minutes and yet he claims that it is soggy and needs reheating? So I accepted the reheating - bad idea as the chicken became dry!I took the food and left. Only to have to drive back because the sweet and spicy sauce was missing. I could have done without the sauce as it just tasted sweet. Lesson here is to check your order yourself, even after they check the bag in front of you. Silver lining is they offered more complementary sides lol.Atmosphere:The place was pretty packed with people enjoying family time and crunchy chicken. Hopefully they had a better experience with service than we did. They do offer daily and lunch specials.', ""We were in the area and found this place so decided to try it out.Honey Garlic (mild) - their mild is not spicy. The honey garlic has a stronger honey flavor than garlic. It's coated with a thick layer of honey. The fried chicken was crispy on the outside but not as juicy and tender on the inside.Spicy soy (spicy) - their spicy had no kick to it so we weren't sure if they forgot to add spice to it. I enjoyed the spicy soy.Cajun fries - portion was good but the fries were a bit hard.Daikon was great but the coleslaw was the traditional ones you get at Korean fried chicken places, it was more similar to American coleslaw.Overall, not our favorite korean fried chicken spot but it's decent."", ""Super EXPENSIVE chicken. \xa0You can do better with Raising Cane's.It's Rice, and it's Chicken. \xa0Oh yeah, Rice Chicken."", ""Sounds like a place that serves rice with chicken but it's actually a fried chicken place that uses rice flour instead of wheat flour to fry their chicken. They do actually have a number of fried chicken options to choose from. Went with the honey garlic chicken and snow cheese chicken and they didn't disappoint. The honey garlic sauce tastes great as a side as well. The snow cheese powder on the other hand needs to be allowed to melt to really get its flavor. Recommend putting it in the microwave first.Rice chicken has definitely nailed the crispiness and spice level though, compared to boss bird kitchen - one of the other (wheat!) fried chicken places around."", ""Really good fried chicken - I wish I had discovered this place before now! When I originally heard about Rice Chicken and looked at their menu, I was worried that it was going to be too spicy, but that wasn't the case. With the mild breading and honey garlic sauce, it was just a tiny bit of spice and a lot of flavor. The boneless chicken was more like popcorn chicken than fried chicken, not greasy but not dry either. The sauce was good, but there was only just barely enough for the chicken.Wasn't a huge fan of the Cajun fries, but they weren't bad. I wish they had a smaller portion of chicken for individuals, but I suppose they probably make good leftovers if you have enough self control to not eat all of them."", 'They are too lazy to cut the peices.The chicken pieces are too big to eat!!I requested to cut it \xa0smaller, but refused.I disppointed their quality and service.They have to know and listen what the customer wants!', 'The Original Spicy Fried Chicken was so yummy and crispy. \xa0First time having my fried chicken battered with rice flour and definitely will not be the last.The Honey Garlic Baked Chicken was moist and tender but not quite as delicious as the fried chicken. We had the honey garlic sauce on the side and that tasted awesome.We also ordered the Cajun fries which were seasoned a little on the salty side but still very good.Will definitely be coming back here for some finger licking good fried chicken!', 'Would you like some delicious chicken? If the answer is yes then navigate to Rice Chicken. I went here last week based on reviews by my fellow Yelpers and the were 100% correct.The place is only doing take out and delivery right now. I ordered a 1/2 honey garlic chicken and asked for the sauce on the side. It came with coke slaw and Daikon radish. But the chicken was the real star of this show. They cook it fresh to order.By the time I got home and opened up the container my chicken was still hot! It was crispy on the outside and juicy on the inside just the way great chicken is cooked!I will be back for sure as I am still dreaming about their delicious chicken.', ""COVID takeout:We've already visited twice before this review!Their fried chicken is so crunchy, and their baked chicken and roast chicken were also great options!We always enjoyed the honey garlic,It might harder to find options for younger children who don't eat as spicy.I wish there were more sides choices for more balanced nutrition other than the radishes that the chicken comes with.We always ordered extras, so we would pop them in the oven the next day to reheat and get them nice and crunchy again.Definitely returning!""]"
